id|symbol|name
3b409fc9-b87f-43c9-ba86-2fa4000a39ed|NOACU|Natural Order Acquisition Corp. Unit
594f9e43-ee03-4ee0-87af-58b7acec4516|NPCE|Neuropace, Inc. Common Stock
cba33b31-f5e2-4c59-8682-ade1168d669e|NRACU|Noble Rock Acquisition Corporation Unit
2ac5b323-95dd-4259-9b4e-5affba4851ed|NRO|Neuberger Berman Real Estate Sec. Income Fund Inc.
af5f2e70-ff4f-4e42-8ee9-1b56be34ab13|NSTD.U|Northern Star Investment Corp. IV Units, each consisting of one share of Class A common stock and on
8b9f4c02-d52d-4df9-9759-31356cc01f0e|NMT|Nuveen Massachusetts Quality Municipal Income Fund
bd82a3d1-8424-4b0f-89bc-877b39f4b743|NXR|NUVEEN ELECT TAX-FREE INC 3
c3e737df-afc9-49a7-84f9-c1663e8ca059|OFC|Corporate Office Properties Trust
8a58bd52-2c64-4632-973d-cf76dc692f35|OPA.U|Magnum Opus Acquisition Limited Units, each consisting of one Class A ordinary share and one-half re
dc2f61a1-58b7-4c89-bfaa-86ef0af932a9|OPTT|Ocean Power Technologies, Inc.
f5138a36-1a7f-4fa2-94ba-756dad8294d6|ORPH|Orphazyme A/S American Depositary Shares
d3621d15-1fce-4e28-ad17-629d62e0de68|NML|Neuberger Berman MLP and Energy Income Fund Inc.
9c9c192d-6a2b-497f-994c-930948eecfa3|NOA|North American Construction Group Ltd.
fae7c5ae-da92-407a-9459-755f2b3588d9|NOM|Nuveen Missouri Quality Municipal Income Fund
69f6caab-a1bb-44f8-8f10-d4fcb9cb0602|NRAC|Noble Rock Acquisition Corporation Class A Ordinary Share
08ae7cfe-8cb0-4ba9-b4b6-8507b0828536|NRK|Nuveen New York AMT-Free Quality Municipal Income Fund
31f0eaf1-2750-4276-8fb1-cdfc200acb52|NRXP|NRX Pharmaceuticals, Inc. Common Stock
39f25e41-5d71-4fa0-9319-1f84f18f9dac|NSL|NUVEEN SENIOR INCM FD
0f040882-7ebf-458b-a48d-ccb2f5194024|NSTD|Northern Star Investment Corp. IV
e40d69f1-7ded-4213-a25b-e1d3cf7af216|NTSX|WisdomTree U.S. Efficient Core Fund
a1d8440b-10c5-4dac-af83-7904a0c33eb1|NOAC|Natural Order Acquisition Corp. Common Stock
7e6da812-17a0-4f51-ac74-52e437c3a998|NSH.U|NavSight Holdings, Inc. Units, each consisting of one share of Class A Common Stock and one-half of
e2720b72-774d-418d-af28-a95ef7f29df0|NSTC|Northern Star Investment Corp. III
b395af8a-5184-4550-b780-837a9d72e553|NTCO|Natura &Co Holding S.A. American Depositary Shares (each representing two Common Shares)
df08b1c9-c1cb-41c4-96ab-0818691e9405|NTRSO|Northern Trust Corporation Depositary Shares Each Representing a 1/1,000th Interest in a Share of Series E Non-Cumulative Perpetual Preferred Stock
87e209f6-d869-4208-99fb-16a54d48b2ca|NURO|NeuroMetrix, Inc. Common Stock
f83152f7-52b2-499c-8c35-eb3e78c634a5|NXP|NUVEEN SELECT TAX-FREE INC
1b43bd32-18b3-40b8-ad92-c09d956cb069|NYMTL|New York Mortgage Trust, Inc. 6.875% Series F Fixed-to-Floating Rate Cumulative Redeemable Preferred Stock, $0.01 par value per share
74610978-d52d-4fc5-aa49-be52a25b6c48|OCA|Omnichannel Acquisition Corp.
cc0243c1-4f66-48f4-b502-c83802efdb75|NRGD|MicroSectors US Big Oil -3x Inverse Leveraged ETN
84bb43f5-cc04-47fa-90c0-7abd0a3065c1|NUW|Nuveen AMT-Free Municipal Value Fund
b7cc2e27-5dd3-4f78-bda6-3dd0c55eebf3|OCAX|OCA Acquisition Corp. Class A Common Stock
dbee8159-25ae-40e5-9b77-f118b8f877e5|OLMA|Olema Pharmaceuticals, Inc. Common Stock
736d5fa2-f5c7-44e7-b774-c04afe96fb08|OMEG|Omega Alpha SPAC Class A Ordinary Shares
a8197d29-d4ee-4def-b093-81a686b3d4f8|PCOM|Points International Ltd. Common Shares
f06a1819-b260-4e75-8e84-301ca685870c|NSTC.U|Northern Star Investment Corp. III Units, each consisting of one share of Class A common stock and o
d25f3990-ef76-4457-b9c0-da3b3e4f0d2a|NTSE|WisdomTree Emerging Markets Efficient Core Fund
20d61a7c-982d-4215-88c8-83cc1e36d4c2|NVSAU|New Vista Acquisition Corp Unit
4445ad52-4e4b-4e18-9287-b1d9ec0b16c3|OCCIP|OFS Credit Company, Inc. 6.875% Series A Term Preferred Stock
b4a68094-1486-4786-a6f6-d6b2d9f43e0d|OLP|One Liberty Properties, Inc.
6b5a164d-b637-477e-9349-7741a006b73d|OOTO|Direxion Daily Travel & Vacation Bull 2X Shares
9afd255c-0a23-4a6e-ad4f-8f8ed0d67a63|NTB|The Bank of N.T. Butterfield & Son Limited
8f818f6e-f043-4c7f-9dd2-2d88fcb1fd45|NUO|Nuveen Ohio Quality Municipal Income Fund
61ecf76a-3fbd-4529-9f54-f128532e3fd0|NUWE|Nuwellis, Inc. Common Stock
01d6384f-8466-479e-8401-4188829edba5|NVMI|Nova Measuring Instruments Ltd. Ordinary Shares
a6e3192c-c913-4112-ba68-612d3f1f55a0|NXC|NUVEEN CA SEL TAX-FREE INC
95b9816c-c514-49eb-b66f-adc1317bd7f2|NUVB|Nuvation Bio Inc.
70024fcd-f4c7-4426-8d85-bc2e2e2fa4bc|NVG|Nuveen AMT-Free Municipal Credit Income Fund
704f139f-a765-46c4-bfc3-1c6c195f26fb|OLO|Olo Inc.
8db29276-52b3-4da5-9802-45ba0313881f|NUGT|Direxion Daily Gold Miners Index Bull 2X Shares
2c082bf5-3dac-44fe-bc96-04f21e091cd0|OEPW|One Equity Partners Open Water I Corp. Class A Common Stock
9dc36a49-27bc-4b88-86e3-8b95c55f057b|OGN|Organon & Co.
3b6d1e75-99ac-479d-86e4-82a1f83aa148|OSI|Osiris Acquisition Corp.
c47aaab1-02db-4315-b46a-c246e096e1fc|NUV|Nuveen Municipal Value Fund, Inc.
f40a0659-a953-419b-b81d-f91e6791240e|NXRT|NexPoint Residential Trust Inc
c84ec179-2744-40f8-8f1c-02e97b8158df|OCCIO|OFS Credit Company, Inc. 6.125% Series C Term Preferred Stock
ed49adec-8612-4c5a-b4d8-bf92043fe724|OTRK|Ontrak, Inc. Common Stock
cdef4586-f23b-4df0-98a5-3a36ab2d172c|PANA|Panacea Acquisition Corp. II Class A Ordinary Shares
516cecba-e73a-4e7a-93fa-a715218dd2d4|OHPAU|Orion Acquisition Corp. Unit
d1db3182-68de-4d05-ae35-a5b39128c367|OMIC|Singular Genomics Systems, Inc. Common Stock
50942665-f5d0-40ff-9762-33f0eab96dc4|OPY|Oppenheimer Holdings, Inc.
6903c83c-356c-4370-bd09-6eb7ca5b8e9a|OTRAU|OTR Acquisition Corp. Unit
06b60919-7eaa-4333-857f-e707c1545139|OWLT|Owlet, Inc.
1612161c-d6f9-456a-8ace-850dfda42438|OG|Onion Global Limited American Depositary Shares (each ten (10) ADSs representing one (1) Class A Ord
a5268a52-6d4f-4738-a235-fbf997a143a2|OIA|INVESCO MUNICIPAL INCOME OPPORTUNITIES TRUST
86248048-95fb-46e3-a760-937c320d6553|ORGN|Origin Materials, Inc. Common Stock
62147d44-21e1-43ac-809e-1b3903705ac2|OSI.U|Osiris Acquisition Corp. Units, each consisting of one share of Class A common stock, and one-half o
48af2491-2bf4-4d9a-bbcf-1bd81f534667|PCOR|Procore Technologies, Inc.
cdb0e226-e7ce-42f3-ad7f-50f3d18ddb1f|ODP|The ODP Corporation Common Stock
c8720069-e02d-448c-9e7c-f808db900df6|OPI|Office Properties Income Trust Common Shares of Beneficial Interest
3a09892d-5876-40d0-8b58-ee54a52cb39d|OSCR|Oscar Health, Inc.
18c6eaf8-8298-46db-8724-562874d55df1|OSTRU|Oyster Enterprises Acquisition Corp. Unit
b0cc9184-1435-40fd-8c28-988e31dd48fe|OTRKP|Ontrak, Inc. 9.50% Series A Cumulative Perpetual Preferred Stock
18e7c311-f086-44dc-a4a6-d9465d13be94|OXLCL|Oxford Lane Capital Corp. 6.75% Notes due 2031
a1d6c582-fa28-41b6-b5a5-183605047509|PACX|Pioneer Merger Corp. Class A Ordinary Share
5a5dbd91-c6d8-4869-825e-2c64457898f1|PBLA|Panbela Therapeutics, Inc. Common Stock
e32a0b89-f69d-4972-97bc-55d5275ca2c4|ORIAU|Orion Biotech Opportunities Corp. Units
8a679d45-eed9-48cd-8d84-10cb5a2625a0|OUST|Ouster, Inc.
c8fbe576-d266-412d-baa7-07b175a7775d|OWL|Blue Owl Capital Inc.
2cc0044f-edcc-49f4-b1c6-f1b861a5c19c|PAAS|Pan American Silver Corp. Common Stock
f07c0c30-7abe-4085-ba11-923594668b6f|PAIC|Petra Acquisition, Inc. Common Stock
973077af-3788-4c75-9ea0-9987e337f564|PAY|Paymentus Holdings, Inc.
c66869b8-88fe-4a33-b5d8-1d3eba2bca92|PCF|High Income Securities Fund
97ee0195-7abd-4feb-86f3-5780363b3abe|PCPC.U|Periphas Capital Partnering Corporation CAPS, each consisting of one share of Class A common stock a
643c6215-58b1-41d9-a7c8-19fcfb7400ff|PFL|PIMCO Income Strategy  Fund
2cb6830a-e2e2-492d-8d86-69b440e7bd79|PFXNL|PhenixFIN Corporation 6.125% Senior Notes due 2023
b7c0d823-b78b-4b5f-99cd-2a1831aca3d7|PGP|PIMCO Global StockPLUS & Income Fund
d1afc76f-a3b5-4c66-b6f6-9e6a624e7de5|PHK|PIMCO High Income Fund
6a8e775c-1cf3-48bf-a3d1-3ceabcbf0a44|OVV|Ovintiv Inc.
09472a02-a467-4cfa-b092-0a886134abde|PAQCU|Provident Acquisition Corp. Units
4fd82748-adfa-41e4-af82-79721e30658b|PCN|PIMCO Corporate & Income Strategy Fund
02e4c489-dbe7-47f5-961b-49ba8011a116|PINE|Alpine Income Property Trust, Inc
7ae62dd7-af9a-4d90-bdd9-c3fc09d8c48d|OTLY|Oatly Group AB American Depositary Shares
f7177d4d-8158-465d-9df2-51b4effa3c7a|PBBK|PB Bankshares, Inc. Common Stock
ba4d1783-46aa-4289-807e-a89f1e141d2a|PCK|PIMCO CALIFORNIA MUNICIPAL INCOME FUND II COMMON SHARES OF BENEFICIAL INT.
307430c7-bfee-4bba-8666-a418a6cf0b9b|PHD|Pioneer Floating Rate Fund, Inc.
defe6979-e35d-47fd-b362-1683e52926e9|OXLCM|Oxford Lane Capital Corp. 6.75% Series 2024 Term Preferred Stock
9ac0375f-6a4b-4cf0-9843-a578293c295a|PBC|Prospect Capital Corporation 6.875% Notes due 2029
8bc231d9-4d8f-44f8-9fe9-cf6153a75d61|PCM|PCM Fund, Inc.
b07b0d70-a8b6-47dd-a048-e8e18a37d792|PDOT.U|Peridot Acquisition Corp. II Units, each consisting of one Class A ordinary share, and one-fifth of
9e7d221f-616e-4c26-84d1-64b917100e92|PEO|Adams Natural Resources Fund, Inc.
b70dd063-3438-4948-9ca2-8fdfa7e7d4b6|PLL|Piedmont Lithium Inc. Common Stock
455803bf-7867-47dc-bd4c-e0db749fc783|PRTC|PureTech Health plc American Depositary Shares
615939cc-49fb-44d0-996e-cf93e2ef90f3|PBUG|Pacer iPath Gold Trendpilot Exchange-Traded Notes
c08d8a68-d483-48db-b50a-4a08b2cda7da|PCH|PotlatchDeltic Corporation Common Stock
89e444de-cdf9-4a9c-b1c4-461a35797462|PCSA|Processa Pharmaceuticals, Inc. Common Stock
4a597d15-ab53-44f7-bfa3-c81657ac758b|PDAC.U|Peridot Acquisition Corp. Units, each consisting of one Class A ordinary share, and one-half of one
e62648b4-5a4c-4843-8cdd-63fdef515d51|PFDR|Pathfinder Acquisition Corporation Class A Ordinary Shares
da753873-6ba8-4026-ba6b-9ed78f659a37|PGM|iPath Series B Bloomberg Platinum Subindex Total ReturnSM ETN
5a7c1b01-05e8-4571-b15b-f8c7ebf9fd76|PHIC|Population Health Investment Co., Inc. Class A Ordinary Share
0923ed33-b7fc-4a47-b2d4-759b8f8ff6e2|PHVS|Pharvaris N.V. Ordinary Shares
d59c78c9-88bc-42de-857f-9e0504c996d4|PICC.U|Pivotal Investment Corporation III Units, each consisting of one share of Class A common stock and o
054ba776-952d-4b97-9e45-c5550aa70ecf|PKE|Park Aerospace Corp. Common Stock
5fc3dbd5-3850-4200-80c8-ab9076c7ba32|PMVC|PMV Consumer Acquisition Corp.
632ab63d-4c97-4703-a7b9-bffdc39a9a87|PRPC|CC Neuberger Principal Holdings III
7d0f8a5e-990e-4546-a8e4-a71403f95ae2|PRT|PermRock Royalty Trust Trust Unit
7a8b5a07-a741-4a5a-9ae6-6827b70f1637|PCI|PIMCO Dynamic Credit and Mortgage Income Fund
51c8b6bc-75be-4536-81e4-64985133f010|PDM|Piedmont Office Realty Trust, Inc.
b08b8f47-856f-4c5b-ac5c-0760904fb8ef|PHICU|Population Health Investment Co., Inc. Unit
8b8419dc-bef9-4078-b9c5-42cbbcd5cb61|PLM|PolyMet Mining Corp.
8fdd4ef1-869e-4c41-9b96-6e4e683c4e7e|PMVC.U|PMV Consumer Acquisition Corp. Units, each consisting of one share of Class A common stock and one-h
286dc373-b1ac-4e29-bae8-365ad2b42b40|PRS|Prudential Financial, Inc. 5.625% Junior Subordinated Notes due 2058
e005c7d5-efba-41cb-8700-7bd159d32cbb|PSACU|Property Solutions Acquisition Corp. Unit
7f441069-afa8-43dc-b264-a9bc456d2489|PDI|PIMCO Dynamic Income Fund
f120d17c-8b26-4b90-b88b-d65cbc90a732|PGZ|PRINCIPAL REAL ESTATE INCOME FUND
092ca24a-b327-4321-9351-2843e50d3d92|PICC|Pivotal Investment Corporation III
f58eec47-be27-4b64-a9ce-1e6246ea1391|PIM|Putnam Master Intermediate Income Trust
7675b54e-3d8f-4eff-9aa2-9799cd3cf04c|PIXY|ShiftPixy, Inc. Common Stock
a6bc33cc-7d3d-4932-97d0-ba1803bc17e0|PMO|Putnam Municipal Opportunities Trust
ea32c3ec-2e39-46fa-b95e-812cb180c981|PNNTG|PennantPark Investment Corporation 5.50% Notes Due 2024
f7b0e01b-465f-420c-97ad-6c5b04424edb|PSAC|Property Solutions Acquisition Corp. Common Stock
63bbbc05-e47e-4431-a2f8-3e57b8afd30c|PSF|COHEN & STEERS SELECT PREFERRED AND INCOME FUND
33d97db5-668b-4e3b-9cac-8e9d382a8fe4|PSTH|Pershing Square Tontine Holdings, Ltd.
c5af83e5-1ef5-4904-a946-80a52c1b2f46|PTOCU|Pine Technology Acquisition Corp. Unit
4d8e644a-2a64-4fca-a280-c6b5b992a45a|PUCK|Goal Acquisitions Corp. Common Stock
6a1daa41-1ef5-4c83-a347-516a6958d397|PDT|John Hancock Premium Dividend Fund
1e79f06b-64e3-4b5a-8234-ffe46ff66497|PFFL|ETRACS Monthly Pay 2xLeveraged Preferred Stock ETN
f3f52754-89bb-448c-8fe9-965837d38d75|PFN|PIMCO Income Strategy Fund II
401bb8b7-15ff-41f3-b2bf-05caf40ad54b|PIAI|Prime Impact Acquisition I
c3202c95-324a-41af-a9af-ea82ce95c45d|PIPP.U|Pine Island Acquisition Corp. Units, each consisting of one share of Class A common stock and one-th
8dcc6049-d904-4971-a02e-ed355fad4846|PGRWU|Progress Acquisition Corp. Units
15768d4d-c977-4b7c-923f-cda43df5b642|PHGE.U|BiomX Inc. Units each consisting of one share of common stock and one Warrant entitling the holder t
a88f7bdf-2c24-4fdb-96df-53ea53276142|PHT|Pioneer High Income Fund, Inc.
1a3e69c8-dc9c-4899-80b3-29770df725f0|PILL|Direxion Daily Pharmaceutical & Medical Bull 3X Shares
d22569e0-7d06-4185-8075-37f291d82035|PLX|Protalix BioTherapeutics, Inc. Common Stock
1cb927c6-bff6-4636-8279-5efaa65be327|PMM|Putnam Managed Municipal Income
197cda66-a11c-4ff6-852e-3ae87ed6f97c|POWRU|Powered Brands Units
a7b92ef6-7e41-4a3c-b31f-94beb358e0a1|PRG|PROG Holdings, Inc.
f72c2995-5896-4933-b8d8-a70d0751a117|PRPC.U|CC Neuberger Principal Holdings III Units, each consisting of one Class A ordinary share, and one-fi
886ce643-fb76-4034-bfe1-4c292ba58a0a|PLMI|Plum Acquisition Corp. I Class A Ordinary Share
843fe67a-9394-45f0-a290-dae9efc67071|PNT|POINT Biopharma Global Inc. Common Stock
12cce4a2-caba-42f1-8969-e15abd2cce2c|PSFE|Paysafe Limited
a48ff43f-0979-4e14-b78b-5cc51711f56b|PWP|Perella Weinberg Partners Class A Common Stock
4f5d26cf-c9e0-49de-9304-5dc8bb8cf389|PYS|Merrill Lynch Depositor Inc. PPLUS Class A 6.30% Callable Trust Certificates, Series RRD-1 (Issued b
7ba4394c-e37b-448c-86da-68583dd9aa56|PLAT|WisdomTree Growth Leaders Fund
7421e2fb-4c7d-4907-8b8a-149b147f8c36|PPT|Putnam Premier Income Trust
c8f0b5ae-4c95-44ff-962d-70905b264364|PRCH|Porch Group, Inc. Common Stock
91a16ebb-93ff-42fc-bd85-574365fe5024|PRLB|PROTO LABS, INC.
3083ce43-1952-4a6e-aa7c-a416917d4634|PLMIU|Plum Acquisition Corp. I Units
f6184c9e-e252-4142-9ca7-0b3292e6a980|PNF|PIMCO NEW YORK MUNICIPAL INCOME FUND COMMON SHARES OF BENEFICIAL INTEREST
669a7439-3234-4ce8-aa2a-e8d6244cc2bd|PNTM|Pontem Corporation
9a0eecb5-9e05-4c00-92da-cf114260f725|PRSR|Prospector Capital Corp. Class A Ordinary Shares
80e803d8-30d1-42ee-a51a-a1f4f747c3fc|PST|ProShares Trust UltraShort Lehman 7-10 Year Treasury
7a06d011-e2f9-444b-910c-e50d38e181af|PTVE|Pactiv Evergreen Inc. Common stock
64c85ee5-e3dd-4bb2-8fe4-4097f6e8d2ea|PYN|PIMCO New York Municipal Income Fund III
15616629-1781-4a85-bdb3-9a3ff5859b00|QQXT|First Trust NASDAQ-100 Ex-Technology Sector Index Fund
97d1bf37-f13a-4953-9ff8-c757508eff09|QVCC|QVC, Inc. 6.250% Senior Secured Notes due 2068
7b478724-edb8-4d9e-aa46-e4e6ce87b815|RAAC|Revolution Acceleration Acquisition Corp Class A Common Stock
1a2545ac-39ed-4341-86ba-b8204596602d|RCHGU|Recharge Acquisition Corp. Unit
7d264f4b-5212-4ccb-8667-96e9a25df0c8|POND.U|Angel Pond Holdings Corporation Units, each consisting of one Class A ordinary share and one-third o
15e9328b-28c4-46ca-aea8-fa2c314c0057|PPGHU|Poema Global Holdings Corp. Unit
2b09fb2d-fba1-45ca-afe0-9395e84b932a|PTICU|PropTech Investment Corporation II Unit
023d4da7-28bf-4aa0-bfbc-9865ebb021de|PUBM|PubMatic, Inc. Class A Common Stock
c4c91a33-6d54-4a97-85fc-2a56c9ef39f8|QLV|FlexShares US Quality Low Volatility Index Fund
ae19cd33-5e13-480b-839e-e941da6a2555|QRTEP|Qurate Retail, Inc. 8.0% Fixed Rate Cumulative Redeemable Preferred Stock
326babfa-a0e1-4d76-9930-fb6fc8d3dfdf|PRSRU|Prospector Capital Corp. Unit
ec4d9573-aae1-4bb4-9ba8-77b30f7cf87f|PRTS|CarParts.com, Inc. Common Stock
c0751847-acee-4bc1-b545-bbc013e2cbbd|PSAG|Property Solutions Acquisition Corporation II Class A Common Stock
c02f2365-ea73-4a44-878f-58a74863ce72|PSPC.U|Post Holdings Partnering Corporation Units, each consisting of one share of Series A common stock, a
b1d78088-c7fb-4eac-b81d-57dfd9db09cb|PSTV|PLUS THERAPEUTICS, Inc. Common Stock
7b975e27-8e99-430e-b089-38027116b067|PTK|PTK Acquisition Corp.
04f96012-af20-480c-b7b2-24b03979b6dd|PTPI|Petros Pharmaceuticals, Inc. Common Stock
49580ea9-415f-4649-81df-e65f5c80b4a0|PVG|PRETIUM RESOURCES INC.
cdccc55a-5990-41a9-8ead-bc8db366b079|RAAS|Cloopen Group Holding Limited American Depositary Shares, each representing two Class A Ordinary Sha
e5fced58-59b8-4675-8ca9-7b1f841f19da|PSLV|Sprott Physical Silver Trust
c4f60c10-3ed3-4903-bcb9-7847fee0fddb|PSTL|Postal Realty Trust, Inc
fba7219f-94cb-40e4-a74f-fb42508ff55b|PTIX|Protagenic Therapeutics, Inc. Common Stock
30368fbf-6577-4166-9bb4-1c5fa480ce68|PSHG|Performance Shipping Inc. Common Shares
405a21eb-3f3f-4d13-929a-8d9d74dc85ca|PTA|Cohen & Steers Tax-Advantaged Preferred Securities and Income Fund
c8b1b619-5c93-4bcc-a9e3-ff7a85a35895|PTIC|PropTech Investment Corporation II Class A Common Stock
ee08f20d-777c-428a-a5ee-78c8ae0826a8|PTY|PIMCO Corporate & Income Opportunity Fund
0c1b3fcf-ba03-4594-9eb3-c27e0afcf433|PUTW|WisdomTree CBOE S&P 500 PutWrite Strategy Fund
b4d797e5-1c80-4636-8208-ce5148109dd6|PSQ|ProShares Short QQQ
4528ad35-45f3-4586-9580-caf32ca3866a|PTRA|Proterra Inc. Common Stock
1e0c9958-6686-4fb8-9d0b-4090d0443269|PVL|Permianville Royalty Trust
fb9ae5a2-ae69-4825-9eeb-cef43fa5ed5d|PSR|Invesco Active U.S. Real Estate Fund
4c7f264c-7fcc-4089-a246-fa31e25b5791|PW|Power REIT
79e15b8c-83e0-4f52-82a3-f855ca137e10|QLD|ProShares Ultra QQQ
30359572-0b2f-4f47-bc52-f430caa4ce38|QQQX|Nuveen NASDAQ 100 Dynamic Overwrite Fund Shares of Beneficial Interest
992bda61-aa14-4991-8f71-873885631610|QSY|WisdomTree U.S. Quality Shareholder Yield Fund
c297bea4-3df0-4a92-b4e9-5bc6d582aacf|RA|Brookfield Real Assets Income Fund Inc.
c1f64fbb-7768-4402-a72a-f1d20b44fd2b|REPL|Replimune Group, Inc. Common Stock
9b52fae0-6de0-42bc-9c37-c3461584eec5|RICOU|Agrico Acquisition Corp. Unit
bbbd5619-3cbc-4498-938e-41532420f1cc|RILYN|B. Riley Financial, Inc. 6.50% Senior Notes Due 2026
cf138ee5-9993-4160-9c42-568873367aae|RJI|AB Svensk Ekportkredit ELEMENTS Linked to the Rogers International Commodity Index-Total Return
1c7e906b-da9f-4594-9f1d-89922300733a|RMGB|RMG Acquisition Corp. II Class A Ordinary Shares
861afdc0-a8bb-46e8-8dde-345a7328c329|PZC|PIMCO California Municipal Income Fund III
1ed4a8e2-903f-46c5-86c4-f1e339250824|QDF|FlexShares Quality Dividend Index Fund
6e6cf800-8443-478b-ad44-54116461a7aa|QGEN|Qiagen NV
0c39f6d5-a39a-451d-b12d-f87d362712ea|QLC|FlexShares US Quality Large Cap Index Fund
83f3a1ce-01b3-4ef6-b5e9-76d2681883b1|RAMMU|Aries I Acquisition Corporation Unit
88503597-485f-496a-8298-0d9fc5da9261|RCLFU|Rosecliff Acquisition Corp I Unit
674784c6-c23a-40dc-a139-b8a45ab3ca4e|RICE.U|Rice Acquisition Corp. Units, each consisting of one share of our Class A common stock and one-half
b42e5b13-8e36-4728-b960-a3cbfd76e906|RILYM|B. Riley Financial, Inc. 6.375% Senior Notes due 2025
c680fc4a-d001-48a8-a531-bbcd9ef11223|RJA|AB Svensk Ekportkredit ELEMENTS Linked to the Rogers International Commodity Index-Agriculture Total
5580841c-1413-4e23-a7f1-a7ad63a67cb2|RLAY|Relay Therapeutics, Inc. Common Stock
e4a0ed73-4f4b-46f1-b478-f25c632c56a2|RMO|Romeo Power, Inc.
32c75f4d-fe4c-4cc1-ad86-fed68c0ce0e7|QABA|First Trust NASDAQ ABA Community Bank Index Fund
eddf084b-56a2-42c6-a790-2c65c4c00ea6|QID|ProShares UltraShort QQQ
9aa5a323-f402-49bb-9e17-80dec3882ed8|QTS|QTS REALTY TRUST, INC.
e6e60f64-98a4-4ac5-aaf4-ee3899ad9791|QVCD|QVC, Inc. 6.375% Senior Secured Notes due 2067
66334bf0-6060-4764-8955-b1950034e4c4|RAACU|Revolution Acceleration Acquisition Corp Unit
30a40c51-ca0b-4501-8199-0c8cb41bac8f|RADI|Radius Global Infrastructure, Inc. Class A Common Stock
5bb23215-7aae-47a4-94df-59f1f610f276|RAVI|FlexShares Ready Access Variable Income Fund
2f75db3f-b32b-430b-8303-8cde72cd049b|PXSAP|Pyxis Tankers Inc. 7.75% Series A Cumulative Convertible Preferred Shares
0feb008f-5526-40f2-84c7-54b9370e8ea1|PYT|Merrill Lynch Depositor PPLUS  Floating Rate Call TR Cert. Ser GSC-2(Goldman Sachs)
c35d97cf-f587-48c9-950d-32b38de0348d|QLVD|FlexShares Developed Markets ex-US Quality Low Volatility Index Fund
92ea9433-cf8d-432f-b04b-79cc81a905e6|QRVO|Qorvo, Inc. Common Stock
0b06bc1c-c480-432a-9be2-a57690c12ee2|QUIK|QuickLogic Corporation Common Stock
b88b06b6-7f00-4c72-a020-2fc8b1f96318|RAM|Aries I Acquisition Corporation Class A Ordinary Share
fc6f3fa8-7174-4ed5-a3b9-4b9e2761801e|RBA|Ritchie Bros. Auctioneers Incorporated
177ff02a-5c5a-4cab-8c51-3c341df56f45|RCC|Ready Capital Corporation 5.75% Senior Notes due 2026
aa8272a8-ad36-47ac-8094-05aaef30edf8|RCLF|Rosecliff Acquisition Corp I Class A Common Stock
870a8bb8-aaa5-4fb3-8ba3-141e1041dc54|RDHL|Redhill Biopharma Ltd. American Depositary Shares
957950bd-72e3-4cef-8ad9-5a0c22422c46|RGLD|Royal Gold, Inc. Common Stock
37270e78-6311-4fd0-9eff-3034d7512a5c|RILYI|B. Riley Financial, Inc. 6.875% Senior Notes due 2023
1967a0b4-49ff-45cf-bf4f-a741b9508953|RMM|RiverNorth Managed Duration Municipal Income Fund, Inc.
ae40b114-2eae-43fc-8337-5338ba1a85dd|QDEF|FlexShares Quality Dividend Defensive Index Fund
5513ab60-a381-47b5-a8c8-f6db04169ed9|QELLU|Qell Acquisition Corp. Unit
8c71a5ca-2a48-40b3-a57c-c158ab24b779|QIPT|Quipt Home Medical Corp. Common Shares
3299741e-f99e-4a67-84fc-3211dddeeeb8|QFTA.U|Quantum FinTech Acquisition Corporation Units, each consisting of one share of Common Stock and one
32944c82-160c-4a7c-a755-915f5632bf74|QLVE|FlexShares Emerging Markets Quality Low Volatility Index Fund
5bbd4d55-26ac-42d7-8cd6-146b35c8ce6f|RCEL|Avita Therapeutics, Inc. Common Stock
92df0cd6-c6ff-4856-8f81-7e1d12402910|RCRT|Recruiter.com Group, Inc. Common Stock
4b0df171-08ea-4228-9554-b0e7f6921fb4|RDWR|Radware Ltd. Ordinary Shares
fe2e3c70-ed73-4cbf-b7e6-40c888e22479|RESD|WisdomTree International ESG Fund
df2533f8-679b-453f-ad95-0f2a9660aac3|REVH|Revolution Healthcare Acquisition Corp. SAIL Class A Common Stock
32e44fcc-9744-4487-a4bd-21e68a03e7d1|RFUN|RiverFront Dynamic Unconstrained Income
0970cf07-e39c-42c9-82c8-ee189222dd91|RGT|Royce Global Value Trust, Inc.
425fc0f5-b4ef-4958-b3c0-0a8c97cd85b3|RALS|ProShares RAFI Long/Short
afd0953c-6744-4455-abb1-c4bbe0ddc1ee|RCB|Ready Capital Corporation 6.20% Senior Notes due 2026
73e0cadb-8460-4dba-ac9b-53e96447212e|REK|ProShares Short Real Estate
474f16c1-3de5-4086-baff-4d3e0100b688|RESE|WisdomTree Emerging Markets ESG Fund
d626f0a6-b6e5-4082-9199-93fbebc9b255|REVHU|Revolution Healthcare Acquisition Corp. SAIL Units
5a971443-46bb-401d-83a2-1d8302919c12|REAX|The Real Brokerage, Inc. Common Shares
0e794b1c-a4a5-4937-be03-74c56b4d2208|RMBL|RumbleOn, Inc. Class B Common Stock
1d373bbf-df28-4e24-b38b-7f5e13c20dbb|ROCCU|Roth CH Acquisition II Co. Unit
df0f4027-d3cf-4255-8127-ed8d707a70b8|RONI.U|Rice Acquisition Corp. II Units, each consisting of one Class A ordinary share and one-fourth of one
10ff03f0-d29e-40de-8f66-c6efa8b490f5|RTPZ|Reinvent Technology Partners Z
fdb90078-bb65-4a2f-9f01-dc1a2e2ae2cd|RVMD|Revolution Medicines, Inc. Common Stock
b7918d89-17c9-4e28-870d-aa3d921a6cb7|RXRX|Recursion Pharmaceuticals, Inc. Class A Common Stock
4bcb31fc-2301-48ce-ba47-d5e1d7c725d1|SBI|Western Asset Intermediate Muni Fund, Inc.
b1fcada1-bffc-47df-813c-ec3f08111e72|REML|Credit Suisse X-Links Monthly Pay 2xLeveraged Mortgage REIT ETN
91b891a9-c9e5-4851-a968-02cca8981e85|RESP|WisdomTree U.S. ESG Fund
4d6d4590-0c1a-44e4-ab6a-cd0e4b9f4d41|REW|Proshares UltraShort Technology
db1e488b-9a66-4dee-b4d9-92b22de24dad|RGC|Regencell Bioscience Holdings Limited Ordinary Shares
5c186d57-e0d9-4550-a723-fb06274633f7|RHP|Ryman Hospitality Properties, Inc
c7a08c9e-b89d-48fc-be83-1a9d1a967584|RING|iShares MSCI Global Gold Miners Fund
58117d69-2f16-4193-ae8a-deaad5b4f49f|RERE|AiHuiShou International Co. Ltd. American Depositary Shares (every three of which representing two C
e97630d8-e178-4f7c-9a15-e82d33182fb9|RIDE|Lordstown Motors Corp. Class A Common Stock
6a4998ed-d418-4e91-bf5a-be4b84628ede|RILYO|B. Riley Financial, Inc. 6.75% Senior Notes due 2024
3fbee0a0-a699-48e2-8d77-952c2fdec37c|RJZ|AB Svensk Ekportkredit ELEMENTS Linked to the Rogers International Commodity Index-Metals Total Retu
d1f418a5-f5e3-4774-b3eb-6266d04b77b2|RMGBU|RMG Acquisition Corp. II Unit
2330ac94-fac5-4d85-bcd3-f854c9faf200|ROCC|Roth CH Acquisition II Co. Common Stock
edab7b92-5ab0-409a-9671-84ceba503d58|RETL|Direxion Daily Retail Bull 3X Shares
64ade8be-5a04-4e75-80e4-21d0f660dab5|RILYH|B. Riley Financial, Inc. 7.375% Senior Notes due 2023
b961c19a-38ce-49f0-be4c-5eb913755955|RKTA|Rocket Internet Growth Opportunities Corp.
161cf5b7-278f-4c5e-b738-986455949d78|RMI|RiverNorth Opportunistic Municipal Income Fund, Inc. Common Stock
90b8f87a-cccf-4403-abd9-4bc6b1b2f8e4|RTPZ.U|Reinvent Technology Partners Z Units, each consisting of one Class A ordinary share and one-fifth o
66b3020e-97e1-4361-9956-42b2ea46937a|S|SentinelOne, Inc.
3d140074-e803-419d-99d5-3a431c78c4fc|SBII.U|Sandbridge X2 Corp. Units, each consisting of one share of Class A common stock and one-third of one
fa1a3109-ea98-47ca-b1c8-c10c2ca282f3|SBRA|Sabra Health Care REIT, Inc. Common Stock
95fc0d5f-2fe2-4ec3-ad86-36c1e4880a82|SCC|ProShares UltraShort Consumer Services
866c5d18-047e-4b99-aca7-c023b74e5ee1|SCO|ProShares UltraShort Bloomberg Crude Oil
ffaed8d4-be56-45f1-94c4-80a17c2cf9eb|RIGS|RiverFront Strategic Income Fund
58986031-e318-49e8-ad73-64051a02a268|RMGCU|RMG Acquisition Corp. III Unit
a050b338-ff1a-4239-a6ab-7ea394eff385|RXL|ProShares Ultra Health Care
c74fd973-fead-4d13-b9b9-fad571d49e82|SAF|Saratoga Investment Corp. 6.25% Notes due 2025
6556f8c0-8a61-4d31-9dba-c618c4555f72|SBSW|Sibanye-Stillwater American Depositary Shares, each representing four ordinary shares
a631802b-b9af-4493-8641-569737d24089|SCLEU|Broadscale Acquisition Corp. Units
361670b4-ea3e-4a02-82b7-454bb351ec5c|SDAC|Sustainable Development Acquisition I Corp. Class A Common Stock
5ae75c95-b220-4c71-a6ff-5700200fd0c5|SDHY|PGIM Short Duration High Yield Opportunities Fund
b20680e4-1233-43e6-811e-9c27eec62b88|SGLB|Sigma Labs, Inc. Common Stock
4045c9f0-5aaf-4e8c-af45-07e672961100|SHCR|Sharecare, Inc. Class A Common Stock
