id|symbol|name
1817b59e-8db2-4b6d-86f7-8da31d49dd09|BPT|BP Prudhoe Bay Royalty Trust
e1dd5c0c-edef-4271-be97-7adb9ce20a67|CNHI|CNH INDUSTRIAL N.V.
9c3096e0-0840-4b62-826d-33096f2be459|PEI|Pennsylvania Real Estate Investment Trust
5a6f1f90-e6f2-4337-b50c-87e0e6335535|AAC.U|Ares Acquisition Corporation Units, each consisting of one Class A ordinary share, and one-fifth of
d058cc01-cdc1-4234-b3c3-e0f975677344|AMJ|JP Morgan Alerian MLP Index ETN 5/24/24
73ba37ba-839e-47ab-a174-d22402394a55|ASXC|Asensus Surgical, Inc.
947023d9-3646-4ef9-a33e-62f8f47d0fc5|BAMR|Brookfield Asset Management Reinsurance Partners Ltd. Class A Exchangeable Limited Voting Shares
9f569f07-ed35-4f78-a5d3-088027b35bda|BIPH|Brookfield Infrastructure Finance ULC 5.000% Subordinated Notes due 2081
154a474a-4b80-45e5-86da-24f9b79e8f9b|BRW|Saba Capital Income & Opportunities Fund
41b24326-7a12-488c-9346-f91f6fddd907|BST|BlackRock Science and Technology Trust
d08f9e71-c27d-47f6-b19f-92554cfab739|CCZ|Comcast Holdings Corp. 2.0% Exchangeable Subordinated Debentures due October 15, 2029 (ZONES)
81c04ce3-404b-446b-89c6-40baafae7e89|CEIX|CONSOL Energy Inc.
5110daf3-e0da-476e-9fec-49ebe69bdffb|CEPU|Central Puerto S.A. American Depositary Shares (each represents ten Common Shares)
ac1b6d2a-d673-4862-bfbb-29ccfcabac75|CHAA.U|Catcha Investment Corp Units, each consisting of one Class A ordinary share, and one-third of one re
0843ee03-993e-4e06-923b-241ce3826418|CLDL|Direxion Daily Cloud Computing Bull 2X Shares
455ce733-7f74-4459-9b83-c81a1163d37b|CWEN.A|Clearway Energy, Inc.  Class A Common Stock
28ddd96a-071d-45dd-a8da-6afbfb08ae8f|AAIN|Arlington Asset Investment Corp. 6.000% Senior Notes Due 2026
22d77b19-025f-4c9d-82c7-01c982c9f425|ADV|Advantage Solutions Inc. Class A Common Stock
97589934-74bb-4553-be32-54fb1f208471|ATY|AcuityAds Holdings Inc. Common Shares
d4c1f1ed-7448-4451-a8ef-ba4cd733d430|AVPT|AvePoint, Inc. Class A Common Stock
a7416318-2773-49b9-b843-7017e0711a5b|BF.B|Brown-Forman Corporation Class B
9e689d8e-0275-4a13-a21d-d518b19eb8f2|BHFAL|Brighthouse Financial, Inc. 6.25% Junior Subordinated Debentures due 2058
6dac6453-b447-4756-9203-a52039b88fb0|BPYPO|Brookfield Property Partners L.P. 6.375% Class A Cumulative Redeemable Perpetual Preferred Units, Series 2
f4aca54e-9ff0-4c76-9435-0436a74bd331|BRLIR|Brilliant Acquisition Corporation Rights
3ee94cdb-4e5a-4d7f-960b-43ac0ce13780|AIO|Virtus AllianzGI Artificial Intelligence & Technology Opportunities Fund
46bc24a8-64cc-4fb2-a01f-b25ac4a019f1|ATMR|Altimar Acquisition Corp. II
7f4cb9a2-45de-49ba-906e-5476a60c6d78|AUY|Yamana Gold, Inc.
ed27cd93-bef1-4796-a97a-dfe98a7768a1|BAMH|Brookfield Finance Inc. 4.625% Subordinated Notes due October 16, 2080
3d400b90-ff72-4c03-8db9-b957661a580b|BOIL|ProShares Ultra Bloomberg Natural Gas
e6eb29d1-ebdd-4038-be9b-b4c5234ea40f|BRIV|B. Riley Principal 250 Merger Corp. Class A common stock
a6069fe3-9857-4768-a00e-ab6491b8cb3a|BSKYU|Big Sky Growth Partners, Inc. Unit
3ac5617c-07ed-4195-a1d7-fe44ab41bf9d|ALACR|Alberton Acquisition Corporation Rights exp April 26, 2021
d2963d4d-951f-4261-b27b-a704d46f321d|AVAN.U|Avanti Acquisition Corp. Units, each consisting of one Class A ordinary share and one-half of one re
436e7551-f42d-4335-81af-13462f33539c|APSG.U|Apollo Strategic Growth Capital Units, each consisting of one Class A Ordinary Share and one-third W
e3fc6492-a60d-47bb-89cb-35b4a233794e|AKR|Acadia Realty Trust
6bc1fb75-bd91-46b0-ac93-88b87b5359cd|BBN|BlackRock Taxable Municipal Bond Trust
e32589a7-fcc4-45ac-84d6-57d366fc04ce|BOND|PIMCO Active Bond Exchange-Traded Fund
58874517-001d-431a-ab61-8ab6a1d919b1|BTAQU|Burgundy Technology Acquisition Corporation Unit
413a623d-e122-4da3-aba7-0e94ea6d2133|CARZ|First Trust Exchange-Traded Fund II First Trust NASDAQ Global Auto Index Fund
602f4042-b470-4fd2-ac0b-5b3e46760d29|CCOR|Core Alternative Capital
dfd449f6-3940-4b34-8311-a896271360f3|CDOR|Condor Hospitality Trust, Inc. Common Stock
f02f6eab-7c3b-457a-9824-8e2845940831|CEE|The Central and Eastern Europe Fund, Inc.
dbc04633-2b39-4a09-9ced-acd0541c241a|CENH|Centricus Acquisition Corp. Class A Ordinary Share
7dbc5cf8-00c0-4b30-8bc2-a969af41bfaa|CPUH|Compute Health Acquisition Corp.
317fa034-bbfa-40ae-946e-e4a02d9af27f|CTT|CATCHMARK TIMBER TRUST, INC.
7f1a0812-386d-4f74-b57f-ff41b37b06b3|DEM|WisdomTree Emerging Markets High Dividend Fund
0bba24e4-15d5-43b6-a2e9-c1da501a1316|DHCAU|DHC Acquisition Corp. Unit
f79f52f0-d23f-4f91-9115-57bc84b69cd0|DNAD|Social Capital Suvretta Holdings Corp. IV Class A Ordinary Shares
98b17f88-d42d-4dd0-b92a-13e26bd414cb|EDSA|Edesa Biotech, Inc. Common Shares
7bb5d4af-30de-4f23-9faa-740e5cc6a1c3|VIH|VPC Impact Acquisition Holdings Class A Ordinary Shares
e52a43f7-1fc4-4ffd-8a94-039d77141943|ATTO|Atento S.A.
049ef930-0ac7-49ef-b7c4-d45b5269af2b|AVAH|Aveanna Healthcare Holdings Inc. Common Stock
7e17ff71-e2e4-4cbb-9a98-20a998ed766a|BDXB|Becton, Dickinson and Company Depositary Shares, each Representing a 1/20th Interest in a Share of 6
9e099acd-1e6e-42e6-ba99-644a484de32d|ATVC|Tribe Capital Growth Corp I Class A common stock
96cc151f-61ed-49f7-916e-ddb238fa0039|BEPH|Brookfield BRP Holdings (Canada) Inc. 4.625% Perpetual Subordinated Notes
f83eacb9-c1a2-4385-95f5-0e2a3ee2fefd|BRPMU|B. Riley Principal 150 Merger Corp. Unit
4d428bac-40bf-4380-9f9d-dcedaea73831|BSN.U|Broadstone Acquisition Corp. Units, each consisting of one Class A ordinary share and one-half of on
1cb91a7b-5f47-44d0-bab0-d1a184fdf485|BVH|Bluegreen Vacations Holding Corporation
542afdd1-bddc-4fa8-b382-fcd8e12bd17a|ATVCU|Tribe Capital Growth Corp I Units
058bcebe-c908-47e2-80ae-752411d160db|BDCZ|ETRACS Wells Fargo Business Development Company Index ETN Series B due April 26, 2041
b6cfac1d-e9b3-4a94-94a1-e8b8f94ea854|BGSX.U|Build Acquisition Corp. Units, each consisting of one share of Class A common stock and one-third of
5fbc5b95-3c44-4dfe-9efe-5b0512bc9474|BITF|Bitfarms Ltd. Common Stock
2de9fb15-1bb7-4ae8-b2f2-4da906109ce0|BSA|BrightSphere Investment Group Inc. 5.125% Notes due 2031
0c534a64-aa48-433f-aa8d-e0501bb7815d|CAP.U|Capitol Investment Corp. V Units, each consisting of one share of Class A common stock, and one-thir
37fe6051-e0c8-4a0d-be99-2acaeb8e844d|CFFE|CF Acquisition Corp. VIII Class A Common Stock
3f9c36fa-7993-451a-acd6-1490f46ac68a|ATLCP|Atlanticus Holdings Corporation 7.625% Series B Cumulative Perpetual Preferred Stock, no par value per share
d1dc0c82-3ec5-450b-afc7-48273e243e29|AUS|Austerlitz Acquisition Corporation I
25b56d84-be09-4166-9fbe-5723991ca040|AVTE|Aerovate Therapeutics, Inc. Common Stock
c32dc6e1-d256-4499-bf8a-d097543e3335|BAL|iPath Series B Bloomberg Cotton Subindex Total ReturnSM ETN
d4a03a6c-3df4-476f-9ff5-cee722c8a3ff|BICK|First Trust Exchange-Traded Fund II First Trust BICK Index Fund
00e089db-65ff-449a-9903-982f4964a4b7|BLDE|Blade Air Mobility, Inc. Class A Common Stock
ae23d831-6bea-4aea-b5ed-afed536d4a74|BRDG|Bridge Investment Group Holdings Inc.
b3d1dc0a-3d59-4314-9ad2-e542adfcddbf|BTBT|Bit Digital, Inc. Ordinary Shares
3fc43e77-cbcf-4ae8-bbc3-fa7b7b736ce6|BENEU|Benessere Capital Acquisition Corp. Unit
c21865df-cba9-4f83-9b51-b36f9bcb59bf|BITE|Bite Acquisition Corp.
b4764beb-d429-4277-96a0-a7fb96ef0622|BTX|Brooklyn ImmunoTherapeutics, Inc.
4f3df4a0-3ac1-43a1-b4d9-e9bca32ddb28|CANO|Cano Health, Inc.
8b170cf2-57f4-433b-b4fc-fd47ead2b9e2|CD|Chindata Group Holdings Limited American Depositary Shares
f3486b2d-eaff-4fce-a8ca-0f061ef02b7d|BIGZ|BlackRock Innovation and Growth Trust
c1f980c1-cd9e-41e6-b1fb-b97452193bf6|BRMK|Broadmark Realty Capital Inc. Common Stock
4301dab4-7e20-461c-a3cc-412a6ba631f0|STPC|Star Peak Corp II
db0a736e-d40d-4209-b9f3-eefb632d3bc7|CEN|Center Coast Brookfield MLP & Energy Infrastructure Fund
c25f1509-32db-4009-ba72-f39d1bec4385|CETXP|Cemtrex Inc. Series 1 Preferred Stock
0d30a5cc-ed77-42eb-8e95-762143e21ff7|CLRM|Clarim Acquisition Corp. Class A Common Stock
87129c04-8313-46aa-949a-8c0504ae69a6|CMSC|CMS Energy Corporation 5.875% Junior Subordinated Notes due 2078
a6d43116-4e87-46b2-8d46-dbb2a3ebaad0|DFJ|WisdomTree Japan SmallCap Dividend Fund
cfa8291a-151f-447b-8eab-5dd5215994a8|CAHC|CA Healthcare Acquisition Corp. Class A Common Stock
11c88e36-0405-42e6-b17a-11348a411b92|CBAY|CymaBay Therapeutics Inc. Common Stock
00dac017-6d1b-40df-b67a-4669886dfa0e|CCNEP|CNB Financial Corporation Depositary Shares, each representing a 1/40th ownership interest in a share of 7.125% Series A Fixed-Rate Non-Cumulative Perpetual Preferred Stock
4921141d-3e8b-4b94-a16e-21864e2a0a65|CDZIP|Cadiz, Inc. Depositary Shares
ef0583a8-dd45-4109-9044-4d7a8ff7800b|CGABL|The Carlyle Group Inc. 4.625% Subordinated Notes due 2061
cec07222-f0b4-42dd-8472-46aa2169cdd3|CMII|CM Life Sciences II Inc. Class A Common Stock
f065026f-e2bc-477a-8251-2b4b27e3c40a|COWNL|Cowen Inc. 7.75% Senior Notes due 2033
e1a1a555-c211-4949-84d9-a7aaa683fa1b|CRDF|Cardiff Oncology, Inc. Common Stock
9e878c6b-bdb1-4142-8e08-71a0e3e26511|CVRX|CVRx, Inc. Common Stock
28bf7b67-c244-4c0d-a92b-d74230f0d9c7|DEW|WisdomTree Global High Dividend Fund
2df91adf-7cec-44c0-8460-2cf200eca75a|BTNB|Bridgetown 2 Holdings Limited Class A Ordinary Shares
2526cf29-cc72-4d73-9570-f81229bbfb8e|BWMN|Bowman Consulting Group Ltd. Common Stock
050a82c2-126c-498a-8cd3-32aa43c69c73|CFAC|CF Finance Acquisition Corp. III Common Stock
2cb4b0f8-ecd0-4058-9ec3-06a157a01b55|CFVIU|CF Acquisition Corp. VI Unit
3cea8e71-eecd-4ccb-a165-b4b30275785a|CHAQ.U|Chardan Healthcare Acquisition 2 Corp. Units, each consisting of one share of Common Stock, and one
92de95ab-78d2-47fc-b276-5ed997ddb5db|CHI|Calamos Convertible Opportunities and Income Fund Common Stock
ca4874cb-2eb2-4af5-b2ac-e95acf15e26b|CHPT|ChargePoint Holdings, Inc.
aa033cd1-d17f-4aa0-8467-5ca6464f4df6|CMLFU|CM Life Sciences, Inc. Unit
d3a38336-bac5-423a-ba46-4364f8557086|CPAR|Catalyst Partners Acquisition Corp. Class A Ordinary Share
8111d476-0dbd-4d36-9139-f1a2f05c0522|DDF|Delaware Investments Dividend & Income Fund, Inc.
07f5d0e8-6826-4c06-b8bf-808b6f6dd768|DILAU|DILA Capital Acquisition Corp. Unit
44d0ccf2-e7c6-4d6c-b52c-a52db3c2d6c1|ECF|Ellsworth Growth and Income Fund Ltd
57a0b054-7b81-4195-b286-fa0fff507090|ELMS|Electric Last Mile Solutions, Inc. Class A Common stock
07c26160-8afc-4ff4-a063-a69ad5e72219|ENVX|Enovix Corporation Common Stock
1905ea83-0c3a-4621-89a3-78a4bbb3dedb|EOSE|Eos Energy Enterprises, Inc. Class A Common Stock
6b827d81-55db-4642-bdd0-86390fd0a935|CEF|Sprott Physical Gold and Silver Trust
f04f4ed2-b85d-4865-8c33-78da199f5c75|CEV|Eaton Vance California Municipal Income Trust
162fcb52-39b9-4800-9e68-4e779519266e|CFFVU|CF Acquisition Corp. V Unit
5af157c9-a5da-40ee-a725-b14c01ce7d66|CHFW|Consonance-HFW Acquisition Corp.
c3c3a6e0-3e09-4ee6-b577-f2e1ce0cfc4b|CLRMU|Clarim Acquisition Corp. Unit
3372da95-885a-46c2-8b8d-57b4a8de07ff|COOL|Corner Growth Acquisition Corp. Class A Ordinary Shares
171c5b74-d739-4ceb-b879-e22ae5ff896f|CPTK|Crown PropTech Acquisitions
7bc57edb-04f2-451e-9d9f-465ab07d8dc6|DGZ|DB Gold Short ETN due February 15, 2038
f0436226-0cf4-4b21-a854-73b8e8f942f8|DNAC|Social Capital Suvretta Holdings Corp. III Class A ordinary shares
65506476-2558-4092-a17b-5aa67bf14b2f|DSS|Document Security Systems, Inc.
ea11fbd6-a2d5-41bd-a4fc-4580aec1578d|EFOI|Energy Focus, Inc. Common Stock
9ba64492-9046-4c4a-a91e-8589af90dc10|EMP|Entergy Mississippi, LLC First Mortgage Bonds, 4.90% Series due October 1, 2066
e982d032-f7f8-4e11-8466-7126eed8fe8a|CCAC.U|CITIC Capital Acquisition Corp. Units, each consisting of one Class A ordinary share, $0.0001 par va
8f2db6d6-d728-436c-a173-71b20eb5fe82|CCVI.U|Churchill Capital Corp VI Units, each consisting of one share of Class A common stock, and one-fifth
2f826442-eb87-45c1-9fb2-53be534a0006|CEW|WisdomTree  Emerging Currency Strategy Fund
199cb7ce-8ed9-4d04-8270-a1ad319d5a6b|CFG|Citizens Financial Group, Inc.
18202357-4a61-4ddc-b096-54752954b7bf|CHAA|Catcha Investment Corp
2a0b30f5-de7b-4c96-81f0-9c93b3db2813|CHFW.U|Consonance-HFW Acquisition Corp. Units, each consisting of one Class A Ordinary Share, and one-third
9a7f6871-fee4-43af-89e6-84d40667df1b|CHMI|CHERRY HILL MORTGAGE INVESTMENT CORPORATION
37c5ff61-cf6d-4e7e-bdf0-6aef1360eae8|CLAQU|CleanTech Acquisition Corp. Units
c0b2c0db-e808-495b-8d39-6d084379f383|CPUH.U|Compute Health Acquisition Corp. Units, each consisting of one share of Class A common stock and one
335c2c56-5599-4eef-814a-f02f2a8df559|DBGI|Digital Brands Group, Inc. Common Stock
93e010f3-8c78-4ba2-b03f-ea686c3f7251|DNN|Denison Mines Corp
4b6d551c-7255-4d10-a9f6-eeca142068ad|DRAYU|Macondray Capital Acquisition Corp. I Unit
aa6e7cd2-c39f-4dbd-9df3-9f47da195e52|EBACU|European Biotech Acquisition Corp. Units
84e19887-7710-4ab6-930d-b61dc305efd8|ECCW|Eagle Point Credit Company Inc .6.75% Notes due 2031
7de46c0c-0499-431b-a227-62ba57bc270d|EFO|ProShares Ultra MSCI EAFE
7bf8fff6-42fa-4c04-bb0d-a068384fa05e|ENBL|ENABLE MIDSTREAM PARTNERS, LP
8d1b520c-d1bd-49af-b848-74cc2c10832b|CFACU|CF Finance Acquisition Corp. III Unit
5ba9cfee-1d1a-4d9f-b80e-84ca5debfbc9|CFXA|Colfax Corporation 5.75% Tangible Equity Units
bf1c4d79-8b98-4b32-95ac-75221460b753|CHAU|Direxion Daily CSI 300 China A Share Bull 2X Shares
5b68ccda-566b-4a61-9ba8-cd51a51581e4|CWEB|Direxion Daily CSI China Internet Index Bull 2X Shares
c54194ca-cc70-454c-897b-b6a0957241db|DNAY|Codex DNA, Inc. Common Stock
c2a3142a-bf7b-4cbe-8fcb-532afcfef886|DPG|Duff & Phelps Utility and Infrastructure Fund Inc.
cccaed94-a662-4699-bd31-70f8c0400c9c|DTD|WisdomTree U.S. Total Dividend Fund
65efb8e6-1c06-4e90-a9ce-44940d7039c3|EDF|STONE HARBOR EMERGING MARKETS INCOME FUND
3a0f9e90-da18-4bfa-ba91-5fc8c89d8906|EDTX|EdtechX Holdings Acquisition Corp. II Class A common stock
e9723efd-421b-464e-b769-180d0547de86|ELP|Companhia Paranaense de Energia American Depositary Shares (each representing one Unit consisting o
86a952df-4816-4627-b80e-8ae54e0cb184|EMD|Western Asset Emerging Markets Debt Fund, Inc
213590fd-974c-4c7d-853b-552664d8de2c|EMO|ClearBridge Energy Midstream Opportunity Fund Inc.
ce2c7bda-4780-459b-8eb2-b5f02ae5b85a|ENVB|Enveric Biosciences, Inc. Common Stock
9e160b8e-cfd2-4b5a-bffb-ec14a139a4aa|ERESU|East Resources Acquisition Company Unit
ba0a5067-b5e4-4919-b64c-1cbf86021693|ESM.U|ESM Acquisition Corporation Units, each consisting of one Class A ordinary share and one-third of on
00af68fd-0e9f-4e6a-b23f-44476cadf4cb|CRZN|Corazon Capital V838 Monoceros Corp Class A Ordinary Shares
6aecf8c9-0231-44e0-95ba-6568827e0ddf|CURV|Torrid Holdings Inc.
efac5145-0a5e-42fd-b3ab-1a55d162254b|DEH.U|D8 Holdings Corp. Units, each consisting of one Class A ordinary share and one-half of one redeemabl
5aa34aad-867b-406e-aee1-7650a1c05c1f|DGRW|WisdomTree Trust WisdomTree U.S. Quality Dividend Growth Fund
44f7f183-efa3-40e3-be7d-410c224c0975|DNAB|Social Capital Suvretta Holdings Corp. II Class A Ordinary Shares
c67c1178-5dc2-4070-9008-a5eab03aae0b|EBR|Centrais Eletricas Brasileiras S.A.- Eletrobras American Depositary Shares (Each representing one Co
bd8021fb-caa7-459d-83d4-d51731be6686|EGF|Blackrock Enhanced Government Fund, Inc.
e98f0667-4f52-48c2-977c-bc333929650e|ELDN|Eledon Pharmaceuticals, Inc. Common Stock
f7aaf991-53ae-4113-bf50-baebeed85b6b|EMX|EMX Royalty Corporation
65bab983-94a7-4ba2-96ee-b903f2f0f65e|ENNVU|ECP Environmental Growth Opportunities Corp. Unit
efaf8e12-3e2b-4c2e-8a15-ea1ddc734f53|ESGG|FlexShares STOXX Global ESG Select Index Fund
cd95a773-7ed6-478f-8fe3-addd769ccfda|EUSGU|European Sustainable Growth Acquisition Corp. Unit
5f868a7f-3c81-4094-b7ab-85eb0a82d893|EVOJ|Evo Acquisition Corp. Class A Common Stock
7091346d-b94b-45cb-b0a3-1bba43ab6b56|DJCB|ETRACS Bloomberg Commodity Index Total Return ETN Series B due October 31, 2039
46c61609-682d-48ee-92e4-8f03cce7be49|DMYI|dMY Technology Group, Inc. III
b84bf82f-e67c-4b3b-9d99-95e61e27a386|DNZ.U|D and Z Media Acquisition Corp. Units, each consisting of one share of Class A Common Stock and one-
829bf9b1-31cc-42b9-af16-b7a8d0b7d25d|EBON|Ebang International Holdings Inc. Class A Ordinary Shares
d5ca021b-7065-4041-9637-028088422b78|EDR|Endeavor Group Holdings, Inc.
b2bef45f-7c03-406b-a004-f348b965252f|EET|ProShares Ultra MSCI Emerging Markets
99c95989-93b2-4266-9530-b2807bfaaa56|ELD|WisdomTree Emerging Markets Local Debt Fund
6cae183c-a1fc-41ee-9f6e-16424a372729|ERES|East Resources Acquisition Company Class A Common Stock
ddbc8794-6b6e-49a6-ae95-2aaeb9b5fbd2|ERYP|Erytech Pharma S.A. American Depositary Shares
e8501043-d783-4cfa-a7c0-ff73c0bff980|ESSCU|East Stone Acquisition Corporation Unit
ea929167-037f-4314-916c-dba8eda909d4|ETW|Eaton Vance Tax-Managed Global Buy-Write Opportunities Fund
91a574a1-d17a-4660-a06b-dbd9cba914e5|FDUSG|Fidus Investment Corporation 5.375% Notes Due 2024
4d29c2a3-c62b-44bf-8339-6731b51f5910|DNUT|Krispy Kreme, Inc. Common Stock
900b6f9e-9cfb-4583-84d0-2d9b3f14bbb8|DRW|WisdomTree Global ex-US Real Estate Fund
8a29f2f5-3d53-49f1-8f77-5e3408dd4941|DTN|WisdomTree U.S. Dividend ex-Financials Fund
7bac6b08-4db6-4e8e-bebb-17100b386363|EBLU|Ecofin Global Water ESG Fund
747effff-dbf6-4baa-80af-57893f4e3905|ECCX|Eagle Point Credit Company Inc. 6.6875% Notes due 2028
19f6be84-0501-4ef1-b497-72afeeb68471|EFR|Eaton Vance Senior Floating-Rate Fund
e59a2b5d-2db2-4681-a780-c0024f824929|EIC|Eagle Point Income Company Inc.
eae4055f-d0b5-4b8e-aa8a-883997eb6dc9|ELC|Entergy Louisiana, LLC Collateral Trust Mortgage Bonds, 4.875 % Series due September 1, 2066
c1a8c14f-3b4a-4874-9846-7028abc771cc|ENX|Eaton Vance New York Municipal Bond Fund
ad853879-c7d0-4c8a-8cb3-6d5d455b8578|EQD.U|Equity Distribution Acquisition Corp. Units, each consisting of one share of Class A common stock, a
cdc0c039-07a4-4749-8b01-c3589c8eff8b|EVF|Eaton Vance Senior Income Trust
959f1dcb-5710-4f25-bff4-fe1ac0105d78|EVV|Eaton Vance Limited Duration Income Fund
a487a9e5-c389-4c6e-892e-1b058b63f870|EDZ|Direxion Daily Emerging Markets Bear 3x Shares
1e9bed06-c870-4b66-91b3-ff0c7d145bb9|EGO|Eldorado Gold Corporation
0cf1fe12-27f6-468b-858f-be4898897507|EJFA|EJF Acquisition Corp. Class A Ordinary Share
e3024812-edb5-45ed-af9f-31f1a9e1cd36|ELEV|Elevation Oncology, Inc. Common stock
1dcaa47e-c06d-4821-8694-22deda297e75|EMCB|WisdomTree Trust WisdomTree Emerging Markets Corporate Bond Fund
7cf000cd-c46f-412b-b638-485c5e7cfb90|ENO|Entergy New Orleans, LLC First Mortgage Bonds, 5.50% Series due April 1, 2066
2ad9e2a1-8526-47a8-a0f4-4b1e67e1e452|EOD|WELLS FARGO GLOBAL DIVIDEND OPPORTUNITY FUND
68ca5046-1d02-46ba-86ce-ba0a7ea48be3|EPWR|Empowerment & Inclusion Capital I Corp.
96d2c7d6-0be2-49f6-ac62-c0d31e2b741b|EUSC|WisdomTree Europe Hedged SmallCap Equity Fund
9a6363eb-5c76-4158-a7fc-a187cf54f17c|EVLVU|Evolv Technologies Holdings, Inc. Unit
6723897e-68b7-433d-a665-694d704aeba3|EXN|Excellon Resources Inc.
3c1e6492-07e9-472c-b23a-92c51a23093a|FACA|Figure Acquisition Corp. I
a29ae79f-32ea-4149-b4f5-e4f271abbfbb|FBT|First Trust NYSE Arca Biotechnology Index Fund
586722b5-4bf8-4140-b68e-3a1d737db208|FCRX|First Eagle Alternative Capital BDC, Inc. 5.00% Notes due 2026
2e234472-ada8-4e08-adc6-dfe623736ee8|EEH|ELEMENTS Linked to the SPECTRUM Large Cap U.S.Sector Momentum Index
e83209ff-5930-4ede-860b-e06e4074c30d|EJH|E-Home Household Service Holdings Limited Ordinary Shares
ecd0cc71-3374-40f8-96ee-6d134c7c13c6|ENPC.U|Executive Network Partnering Corporation CAPS, each consisting of one share of Class A common stock,
d8d066a8-7e76-44e9-a293-6485e91a4e09|EPHY|Epiphany Technology Acquisition Corp. Class A Common Stock
0a318be5-d1c3-4ade-adca-0b0d7e69384c|ERY|Direxion Daily Energy Bear 2X Shares
854efdfb-988f-4e29-934e-852008223946|ETG|Eaton Vance Tax-Advantaged Global Dividend Income Fund
fbab94f5-9b96-42ec-a6a4-3a93100dfcdf|ETV|Eaton Vance Tax-Managed Buy-Write Opportunities Fund
7c517482-6e96-4b0c-b90c-e1c6e846b0da|EUO|ProShares UltraShort Euro
624eed5f-e160-4d5a-bdd3-862d272de095|ENSC|Ensysce Biosciences, Inc. Common Stock
91c1caee-2613-4976-b8e6-f046dbc7ca4f|ENVIU|Environmental Impact Acquisition Corp. Unit
2c5331ea-fb2e-4ce8-b8ce-00e78c301d1e|EOI|Eaton Vance Enhanced Equity Income Fund
a237b6db-38d9-4439-b77c-b2570ea4a5d8|ERO|Ero Copper Corp.
cae27c61-7677-4c1a-b360-6af759a78a71|ETB|Eaton Vance Tax-Managed Buy-Write Income Fund
f26dd976-3208-4edc-a759-49b810be1a27|EUM|ProShares Trust Short MSCI Emerging Markets
a18caa90-a447-4bae-86b7-0536ecb31976|EVGO|EVgo Inc. Class A Common Stock
7d8f4885-9f18-4c75-996e-3f829bd14d6a|EVOJU|Evo Acquisition Corp. Unit
2b1db67b-1caf-4405-a7f2-67f42278b65a|EQD|Equity Distribution Acquisition Corp.
6ce3011a-21c8-41fb-90f5-991b1d4de902|ERH|Wells Fargo Utilities and High Income Fund
6dac4bf7-97d3-40f7-81c4-1d4cad6044e4|ESG|FlexShares STOXX US ESG Select Index Fund
6ae28451-5b22-4a19-aa56-775395840bc5|ET|Energy Transfer LP Common Units representing limited partner interests
b34a97e6-593f-4dda-bbd3-b688c20792ea|ETY|Eaton Vance Tax-Managed Diversified Equity Income Fund
c923dff5-c145-41a9-9935-4a98fcf0ff6c|EVCM|EverCommerce Inc. Common Stock
91c790eb-7879-452b-a091-fd1d4b00bb03|EUCRU|Eucrates Biomedical Acquisition Corp. Unit
fcc2ab72-d6c0-4c5e-b838-7c0b450cfb54|EUSG|European Sustainable Growth Acquisition Corp. Class A Ordinary Shares
f0d6c49f-3573-421f-ba51-59acde40eb72|EVG|Eaton Vance Short Duration Diversified Income Fund
ac7a2e5a-5144-4236-8ea1-4f133930d837|EVN|Eaton Vance Municipal Income Trust
9ac8565b-fad5-40d3-a7b5-ddf78df174df|FACT|Freedom Acquisition I Corp.
02714c14-92cc-4b32-b398-ec51b49d7897|FCA|First Trust China AlphaDEX Fund
a6bab895-6960-4598-b3fe-9a9b515f7207|FACA.U|Figure Acquisition Corp. I Units, each consisting of one share of Class A common stock and one-fourt
adea3630-7684-4597-aa34-fb87f16d71d4|EXFO|EXFO Inc
057b082e-9dc0-4996-9553-8933cafa37f8|EZJ|ProShares Ultra MSCI Japan
5237317f-3de0-4414-a090-728ac2416b2a|EWV|ProShares Trust UltraShort MSCI Japan
53adc2e4-2912-43be-b193-8f053c15d219|EXK|Endeavour Silver Corp.
1cb64bec-677e-490f-9bf8-f46e531a423e|FA|First Advantage Corporation Common Stock
e48be00f-00a1-463e-85d0-5c594a3655c7|FDUSZ|Fidus Investment Corporation 6% Notes due 2024
16cc8365-6c4a-4d23-92f1-b3d44a9ff3c1|FFC|Flaherty & Crumrine Preferred and Income Securities Fund Incorporated
4a1af99d-bd08-4d06-a874-22da6c818d63|FGM|First Trust Germany AlphaDex Fund
39b11896-f21b-4df4-a2cc-c45a4a2b64a2|FINMU|Marlin Technology Corporation Unit
46cb971e-b948-4f5e-bcc4-9a1770782340|FACT.U|Freedom Acquisition I Corp. Units, each consisting of one Class A ordinary share and one-fourth of o
3aa77d16-e2b4-43b3-bd76-8aac19e4ad6c|FCNCP|First Citizens BancShares, Inc. Depositary Shares
13d631bc-4afe-415e-8d21-9cd374153945|FEUL|Credit Suisse FI Enhanced Europe 50 Exchange Traded Notes due May 11, 2028 Linked to the STOXX Europ
0115ccf8-42cc-447a-8453-5e53c937db99|FKU|First Trust United Kingdom AlphaDex Fund
7a65a05a-6a76-49e7-87f7-c221a637bb0d|FDD|First Trust STOXX European Select Dividend Income Fund
ed5f22a3-1892-4151-bd26-2e0ef398387b|FEN|First Trust Energy Income and Growth Fund
9155a967-f8d9-40c2-ad6e-77f3fb8279d6|FFA|First Trust Enhanced Equity Income Fund.
fac90d0d-055c-449e-8b4e-71179817f35f|FBZ|First Trust Brazil AlphaDEX Fund
373cf16f-73ba-4088-b3fb-7b163bb649dc|FCT|First Trust Senior Floating Rate Income Fund II
a659f7d4-bf78-4852-9340-136e05d0903c|FIF|FIRST TRUST ENERGY INFRASTRUCTURE FUND
44212094-30fe-4648-b0eb-8066aa3c5a9e|FITBO|Fifth Third Bancorp Depositary Shares each representing a 1/1000th ownership interest in a share of Non-Cumulative Perpetual Preferred Stock, Series K
dc15c135-6749-45bd-b889-685c2e731528|FCAX.U|Fortress Capital Acquisition Corp. Units, each consisting of one Class A ordinary share and one-fift
801d94a1-6b20-4390-bab9-5b3620126901|FEMS|First Trust Developed Markets Small Cap AlphaDex Fund
ec5de36f-1d86-4db4-8b9d-dbc5c36ad2fa|FEX|First Trust Large Cap Core AlphaDEX Fund
5ccfcafb-135b-426f-bffd-65bcbbe0b29a|FIHD|UBS AG FI Enhanced Global High Yield ETN
1adb3445-6498-457a-882a-d16373fbee90|FLAC|Frazier Lifesciences Acquisition Corporation Class A Ordinary Shares
6478ccdd-c399-4dd3-94cc-eb9976ebd829|FLGC|Flora Growth Corp. Common Stock
c2596b83-75ea-4787-8f58-bd7cc0614f2d|FLME.U|Flame Acquisition Corp. Units, each consisting of one share of Class A Common Stock, and one-half of
f356faac-5ee6-4824-9370-79464419f7ac|FIGS|FIGS, Inc.
f477afc9-7067-413d-8c6a-9b83f61b5689|FITBP|Fifth Third Bancorp Depositary Shares each representing 1/40th share of Fifth Third 6.00% Non-Cumulative Perpetual Class B Preferred Stock, Series A
7f1c83b9-c920-43e0-ae85-10c39e9c6662|FDL|First Trust Morningstar Dividend Leaders Index Fund
c31ccb48-9524-4102-a8dc-26dceb5df172|FEI|FIRST TRUST MLP AND ENERGY INCOME FUND
db38e735-b35d-4c86-a0b9-0b3413fcb706|FFR|First Trust FTSE EPRA/NAREIT Global Real Estate Index Fund
25a51a9f-c2d0-4daf-81f4-a5d0957aeba7|FGNA|FG New America Acquisition Corp.
85471325-01ca-45fe-9e59-735d69e0b7b1|FIEE|FI Enhanced Europe 50 ETN
6d278bba-6f04-44c7-b5d7-e8bf2a2b8f81|FINS|Angel Oak Financial Strategies Income Term Trust
e820b17f-97ff-4ecc-b5e2-036c6f259c74|FENC|Fennec Pharmaceuticals Inc. Common Stock
4751f22d-d80a-42ee-b48d-cc166fd9a184|FGFPP|FG Financial Group, Inc. 8.00% Cumulative Preferred Stock
727b4553-b77a-44d7-a0aa-39e847448346|FINM|Marlin Technology Corporation Class A Ordinary Share
e5d208f8-7b6e-468f-add1-c0ea33f5acaf|FLGE|Credit Suisse FI Large Cap Growth Enhanced Exchange Traded Notes
8be7e989-944d-45e0-b745-4b8c84d079c2|FGBIP|First Guaranty Bancshares, Inc. 6.75% Series A Fixed-Rate Non-Cumulative Perpetual Preferred Stock
974684d6-9a64-4d95-ae53-d70c02376e77|FHS|First High-School Education Group Co., Ltd. American Depositary Shares (each representing three (3)
dd73ab9b-a83c-4501-a21d-733e00d542c2|FISK|Empire State Realty OP, L.P. Series 250
ffea0d70-e3e5-4cec-b1e1-8899c8efea16|FJP|First Trust Japan AlphaDEX Fund
19c706b2-2bbc-4b10-9b26-345e86d7c3a3|FIV|First Trust Senior Floating Rate 2022 Target Term Fund Common Shares of Beneficial Interest
5b5ff0aa-66fe-4e14-8699-4c23504d971f|FLACU|Frazier Lifesciences Acquisition Corporation Unit
